{
  "schemaVersion": "0.1.0",
  "id": "layout_fp001_manual_r1",
  "projectId": "fp001",
  "revision": 1,
  "units": "mm",
  "coordinateFrame": "business-z-up-rh",
  "source": {
    "imageArtifactId": "dataset:desktop-floorplans-poc:fp-001",
    "pixelToWorldTransform": [
      28.923076923076923,
      0.0,
      -5784.615384615385,
      0.0,
      -28.923076923076923,
      10672.615384615385,
      0.0,
      0.0,
      1.0
    ],
    "scaleConfidence": 0.9
  },
  "nodes": [
    {
      "x": -462.769231,
      "y": 6218.461538,
      "id": "n001"
    },
    {
      "x": -462.769231,
      "y": 3210.461538,
      "id": "n002"
    },
    {
      "x": 0.0,
      "y": 3210.461538,
      "id": "n003"
    },
    {
      "x": 0.0,
      "y": 115.692308,
      "id": "n004"
    },
    {
      "x": 2950.153846,
      "y": 6739.076923,
      "id": "n005"
    },
    {
      "x": 2950.153846,
      "y": 6218.461538,
      "id": "n006"
    },
    {
      "x": 2950.153846,
      "y": 3210.461538,
      "id": "n007"
    },
    {
      "x": 5177.230769,
      "y": 6739.076923,
      "id": "n008"
    },
    {
      "x": 5177.230769,
      "y": 5697.846154,
      "id": "n009"
    },
    {
      "x": 5177.230769,
      "y": 3210.461538,
      "id": "n010"
    },
    {
      "x": 6739.076923,
      "y": 5697.846154,
      "id": "n011"
    },
    {
      "x": 6739.076923,
      "y": 4859.076923,
      "id": "n012"
    },
    {
      "x": 6739.076923,
      "y": 3210.461538,
      "id": "n013"
    },
    {
      "x": 6739.076923,
      "y": 1388.307692,
      "id": "n014"
    },
    {
      "x": 6739.076923,
      "y": 115.692308,
      "id": "n015"
    },
    {
      "x": 8503.384615,
      "y": 4859.076923,
      "id": "n016"
    },
    {
      "x": 8503.384615,
      "y": 1388.307692,
      "id": "n017"
    }
  ],
  "edges": [
    {
      "id": "w_outer_top_left",
      "startNodeId": "n001",
      "endNodeId": "n006",
      "thickness": 180.0,
      "height": 2800.0,
      "confidence": 0.9
    },
    {
      "id": "w_outer_step_1",
      "startNodeId": "n006",
      "endNodeId": "n005",
      "thickness": 180.0,
      "height": 2800.0,
      "confidence": 0.85
    },
    {
      "id": "w_outer_top_center",
      "startNodeId": "n005",
      "endNodeId": "n008",
      "thickness": 180.0,
      "height": 2800.0,
      "confidence": 0.88
    },
    {
      "id": "w_outer_step_2",
      "startNodeId": "n008",
      "endNodeId": "n009",
      "thickness": 180.0,
      "height": 2800.0,
      "confidence": 0.85
    },
    {
      "id": "w_outer_top_bath",
      "startNodeId": "n009",
      "endNodeId": "n011",
      "thickness": 180.0,
      "height": 2800.0,
      "confidence": 0.86
    },
    {
      "id": "w_outer_step_3",
      "startNodeId": "n011",
      "endNodeId": "n012",
      "thickness": 180.0,
      "height": 2800.0,
      "confidence": 0.82
    },
    {
      "id": "w_outer_top_kitchen",
      "startNodeId": "n012",
      "endNodeId": "n016",
      "thickness": 180.0,
      "height": 2800.0,
      "confidence": 0.88
    },
    {
      "id": "w_outer_right_kitchen",
      "startNodeId": "n016",
      "endNodeId": "n017",
      "thickness": 180.0,
      "height": 2800.0,
      "confidence": 0.9
    },
    {
      "id": "w_outer_bottom_kitchen",
      "startNodeId": "n017",
      "endNodeId": "n014",
      "thickness": 180.0,
      "height": 2800.0,
      "confidence": 0.88
    },
    {
      "id": "w_outer_right_living",
      "startNodeId": "n014",
      "endNodeId": "n015",
      "thickness": 180.0,
      "height": 2800.0,
      "confidence": 0.85
    },
    {
      "id": "w_outer_bottom_living",
      "startNodeId": "n015",
      "endNodeId": "n004",
      "thickness": 180.0,
      "height": 2800.0,
      "confidence": 0.88
    },
    {
      "id": "w_outer_left_living",
      "startNodeId": "n004",
      "endNodeId": "n003",
      "thickness": 180.0,
      "height": 2800.0,
      "confidence": 0.8
    },
    {
      "id": "w_outer_recess",
      "startNodeId": "n003",
      "endNodeId": "n002",
      "thickness": 180.0,
      "height": 2800.0,
      "confidence": 0.8
    },
    {
      "id": "w_outer_left_bed",
      "startNodeId": "n002",
      "endNodeId": "n001",
      "thickness": 180.0,
      "height": 2800.0,
      "confidence": 0.9
    },
    {
      "id": "w_bed_left_right",
      "startNodeId": "n006",
      "endNodeId": "n007",
      "thickness": 120.0,
      "height": 2800.0,
      "confidence": 0.86
    },
    {
      "id": "w_bed_left_bottom",
      "startNodeId": "n003",
      "endNodeId": "n007",
      "thickness": 120.0,
      "height": 2800.0,
      "confidence": 0.84
    },
    {
      "id": "w_bed_center_right",
      "startNodeId": "n009",
      "endNodeId": "n010",
      "thickness": 120.0,
      "height": 2800.0,
      "confidence": 0.82
    },
    {
      "id": "w_bed_center_bottom",
      "startNodeId": "n007",
      "endNodeId": "n010",
      "thickness": 120.0,
      "height": 2800.0,
      "confidence": 0.82
    },
    {
      "id": "w_bath_bottom",
      "startNodeId": "n010",
      "endNodeId": "n013",
      "thickness": 120.0,
      "height": 2800.0,
      "confidence": 0.78
    },
    {
      "id": "w_kitchen_left_upper",
      "startNodeId": "n012",
      "endNodeId": "n013",
      "thickness": 120.0,
      "height": 2800.0,
      "confidence": 0.8
    },
    {
      "id": "w_kitchen_left_lower",
      "startNodeId": "n013",
      "endNodeId": "n014",
      "thickness": 120.0,
      "height": 2800.0,
      "confidence": 0.78
    }
  ],
  "openings": [
    {
      "id": "door_bed_left",
      "type": "door",
      "wallEdgeId": "w_bed_left_bottom",
      "offset": 1950.153846,
      "width": 900.0,
      "height": 2200.0,
      "confidence": 0.68
    },
    {
      "id": "door_bed_center",
      "type": "door",
      "wallEdgeId": "w_bed_center_bottom",
      "offset": 1227.076923,
      "width": 900.0,
      "height": 2200.0,
      "confidence": 0.65
    },
    {
      "id": "door_bath",
      "type": "door",
      "wallEdgeId": "w_bath_bottom",
      "offset": 100.0,
      "width": 800.0,
      "height": 2100.0,
      "confidence": 0.62
    },
    {
      "id": "door_kitchen",
      "type": "door",
      "wallEdgeId": "w_kitchen_left_lower",
      "offset": 822.153846,
      "width": 900.0,
      "height": 2200.0,
      "confidence": 0.62
    },
    {
      "id": "window_living_south",
      "type": "window",
      "wallEdgeId": "w_outer_bottom_living",
      "offset": 2300.0,
      "width": 3000.0,
      "height": 1500.0,
      "sill": 600.0,
      "confidence": 0.72
    },
    {
      "id": "window_living_west",
      "type": "window",
      "wallEdgeId": "w_outer_left_living",
      "offset": 1500.0,
      "width": 1000.0,
      "height": 1500.0,
      "sill": 600.0,
      "confidence": 0.58
    },
    {
      "id": "window_bed_left",
      "type": "window",
      "wallEdgeId": "w_outer_top_left",
      "offset": 100.0,
      "width": 900.0,
      "height": 1500.0,
      "sill": 600.0,
      "confidence": 0.55
    }
  ],
  "roomAnnotations": [
    {
      "id": "room_bed_left",
      "type": "bedroom",
      "label": "卧室",
      "anchor": {
        "x": 1446.153846,
        "y": 4743.384615
      },
      "confidence": 0.88
    },
    {
      "id": "room_bed_center",
      "type": "bedroom",
      "label": "卧室",
      "anchor": {
        "x": 4049.230769,
        "y": 5177.230769
      },
      "confidence": 0.84
    },
    {
      "id": "room_bath",
      "type": "bathroom",
      "label": "卫生间",
      "anchor": {
        "x": 5929.230769,
        "y": 4454.153846
      },
      "confidence": 0.8
    },
    {
      "id": "room_kitchen",
      "type": "kitchen",
      "label": "厨房",
      "anchor": {
        "x": 7664.615385,
        "y": 3152.615385
      },
      "confidence": 0.84
    },
    {
      "id": "room_living_dining",
      "type": "living_dining",
      "label": "客餐厅",
      "anchor": {
        "x": 3760.0,
        "y": 1417.230769
      },
      "confidence": 0.86
    }
  ],
  "contentHash": "d239b827bed97e77d7c1f1dff9939275d20a71a20dfcf11a7eb230e790e88766"
}
